{
  "schemaVersion": 1,
  "owner": "Brandon-Born",
  "monitoringDays": 7,
  "emergencyResponseHours": 24,
  "observations": [
    {
      "url": "https://en.doc.boardgamearena.com/BGA_Studio_Migration_Guide",
      "digest": "sha256:c66f27183cada48fae71158f2da8c39f87c760fa956d43a72954a8d87ec3d52c",
      "observedAt": "2026-10-02T12:04:13.674Z",
      "review": {
        "digest": "sha256:c66f27183cada48fae71158f2da8c39f87c760fa956d43a72954a8d87ec3d52c",
        "implementationDigest": "sha256:a0acaa4956d2ab2bbb56a08116c56448e6565cc53c757ed9b0eb00c540897c5c",
        "evidenceDigest": "sha256:61af65f81b1f293934bc76d9ac16fba06b00f4d080d5bbe7e7f698f61f680ae3",
        "evidenceCommit": "a34f7cf2f699d8b25721cf91bfc901b58e788cc3",
        "ciRun": "https://github.com/Brandon-Born/bga-mcp/actions/runs/37015716008",
        "reviewer": "Codex",
        "reviewedAt": "2026-10-02T13:57:20.329Z",
        "fixturePaths": [
          "tests/fixtures/projects/comment-contract-controls",
          "tests/fixtures/projects/comment-contract-reproduction",
          "tests/fixtures/projects/hybrid",
          "tests/fixtures/projects/legacy",
          "tests/fixtures/projects/modern",
          "tests/fixtures/projects/modern-broken",
          "tests/fixtures/projects/modern-generated-regression",
          "tests/fixtures/projects/modern-source-scope-unreadable",
          "tests/fixtures/projects/modern-state-classes",
          "tests/fixtures/projects/modern-unreadable"
        ],
        "scenarios": [
          "E2E-AUDIT-DATABASE-ALIASES",
          "E2E-AUDIT-DATABASE-CLEAN",
          "E2E-AUDIT-DATABASE-HYBRID",
          "E2E-AUDIT-DATABASE-MODERN-CLEAN",
          "E2E-CONTRACT-COMMENT-METHOD-MISSING",
          "E2E-CONTRACT-EDITOR-HELPERS",
          "E2E-CONTRACT-EXECUTABLE-CONTROLS",
          "E2E-CONTRACT-INERT-EXAMPLES",
          "E2E-CONTRACT-UNKNOWN-GRAMMAR",
          "E2E-CONTRACT-UNKNOWN-PHP",
          "E2E-DOCS-ADVERTISED",
          "E2E-DOCS-TOPIC-LISTED",
          "E2E-FRAMEWORK-VERSION-LISTED",
          "E2E-INSPECT-JSONC-COMPONENTS",
          "E2E-INSPECT-PROJECT-HYBRID",
          "E2E-INSPECT-PROJECT-LEGACY",
          "E2E-INSPECT-PROJECT-MODERN",
          "E2E-LEGACY-CLIENT-ROOTS",
          "E2E-PRE-RELEASE-CLEAN",
          "E2E-PRE-RELEASE-HYBRID",
          "E2E-PRE-RELEASE-PARTIAL-SUPPORT",
          "E2E-PROJECT-SOURCE-MODULES",
          "E2E-PROJECT-SOURCE-SCOPE",
          "E2E-PROJECT-SOURCE-SELECTION",
          "E2E-RESOURCE-DIAGNOSTICS",
          "E2E-RESOURCE-LAYOUT-MATRIX",
          "E2E-RESOURCE-STATES",
          "E2E-RESOURCE-SUMMARY",
          "E2E-SETUP-READY",
          "E2E-STATE-DELEGATED-RETURNS",
          "E2E-STATE-UNCONFIRMED-INITIAL",
          "E2E-STUDIO-LOGS-DISABLED",
          "E2E-VALIDATE-ACTION-SCOPES",
          "E2E-VALIDATE-ACTIONS-CLEAN",
          "E2E-VALIDATE-ACTIONS-HYBRID",
          "E2E-VALIDATE-ACTIONS-MODERN-CLEAN",
          "E2E-VALIDATE-MODERN-DOCUMENTATION-CONFLICT",
          "E2E-VALIDATE-NOTIFICATIONS-CLEAN",
          "E2E-VALIDATE-NOTIFICATIONS-HYBRID",
          "E2E-VALIDATE-NOTIFICATIONS-MODERN-CLEAN",
          "E2E-VALIDATE-PROJECT-CLEAN",
          "E2E-VALIDATE-PROJECT-HYBRID",
          "E2E-VALIDATE-PROJECT-MODERN",
          "E2E-VALIDATE-STATES-CLEAN",
          "E2E-VALIDATE-STATES-HYBRID",
          "E2E-VALIDATE-STATES-MODERN-CLEAN",
          "E2E-VALIDATE-UNKNOWN-CROSS-FILE-SHAPES",
          "GATE-FIXTURE-SAFETY"
        ]
      },
      "needsReview": false
    },
    {
      "url": "https://en.doc.boardgamearena.com/Game_database_model:_dbmodel.sql",
      "digest": "sha256:e0a82290661fed460dfa38f6608da50e17e77714ac495e089dc1ee23d2225e9c",
      "observedAt": "2026-10-02T12:04:13.675Z",
      "review": {
        "digest": "sha256:e0a82290661fed460dfa38f6608da50e17e77714ac495e089dc1ee23d2225e9c",
        "implementationDigest": "sha256:a0acaa4956d2ab2bbb56a08116c56448e6565cc53c757ed9b0eb00c540897c5c",
        "evidenceDigest": "sha256:61af65f81b1f293934bc76d9ac16fba06b00f4d080d5bbe7e7f698f61f680ae3",
        "evidenceCommit": "a34f7cf2f699d8b25721cf91bfc901b58e788cc3",
        "ciRun": "https://github.com/Brandon-Born/bga-mcp/actions/runs/37015716008",
        "reviewer": "Codex",
        "reviewedAt": "2026-10-02T13:57:20.877Z",
        "fixturePaths": [
          "tests/fixtures/projects/hybrid",
          "tests/fixtures/projects/legacy",
          "tests/fixtures/projects/modern",
          "tests/fixtures/projects/modern-broken",
          "tests/fixtures/projects/modern-generated-regression",
          "tests/fixtures/projects/modern-source-scope-unreadable",
          "tests/fixtures/projects/modern-state-classes",
          "tests/fixtures/projects/modern-unreadable"
        ],
        "scenarios": [
          "E2E-AUDIT-DATABASE-ALIASES",
          "E2E-AUDIT-DATABASE-CLEAN",
          "E2E-AUDIT-DATABASE-HYBRID",
          "E2E-AUDIT-DATABASE-MODERN-CLEAN",
          "E2E-CONTRACT-EDITOR-HELPERS",
          "E2E-DOCS-ADVERTISED",
          "E2E-DOCS-TOPIC-LISTED",
          "E2E-FRAMEWORK-VERSION-LISTED",
          "E2E-INSPECT-JSONC-COMPONENTS",
          "E2E-INSPECT-PROJECT-HYBRID",
          "E2E-INSPECT-PROJECT-LEGACY",
          "E2E-INSPECT-PROJECT-MODERN",
          "E2E-LEGACY-CLIENT-ROOTS",
          "E2E-PRE-RELEASE-CLEAN",
          "E2E-PRE-RELEASE-HYBRID",
          "E2E-PRE-RELEASE-PARTIAL-SUPPORT",
          "E2E-PROJECT-SOURCE-MODULES",
          "E2E-PROJECT-SOURCE-SCOPE",
          "E2E-PROJECT-SOURCE-SELECTION",
          "E2E-RESOURCE-DIAGNOSTICS",
          "E2E-RESOURCE-LAYOUT-MATRIX",
          "E2E-RESOURCE-STATES",
          "E2E-RESOURCE-SUMMARY",
          "E2E-SETUP-READY",
          "E2E-STATE-DELEGATED-RETURNS",
          "E2E-STATE-UNCONFIRMED-INITIAL",
          "E2E-STUDIO-LOGS-DISABLED",
          "E2E-VALIDATE-ACTION-SCOPES",
          "E2E-VALIDATE-ACTIONS-CLEAN",
          "E2E-VALIDATE-ACTIONS-HYBRID",
          "E2E-VALIDATE-ACTIONS-MODERN-CLEAN",
          "E2E-VALIDATE-MODERN-DOCUMENTATION-CONFLICT",
          "E2E-VALIDATE-NOTIFICATIONS-CLEAN",
          "E2E-VALIDATE-NOTIFICATIONS-HYBRID",
          "E2E-VALIDATE-NOTIFICATIONS-MODERN-CLEAN",
          "E2E-VALIDATE-PROJECT-CLEAN",
          "E2E-VALIDATE-PROJECT-HYBRID",
          "E2E-VALIDATE-PROJECT-MODERN",
          "E2E-VALIDATE-STATES-CLEAN",
          "E2E-VALIDATE-STATES-HYBRID",
          "E2E-VALIDATE-STATES-MODERN-CLEAN",
          "E2E-VALIDATE-UNKNOWN-CROSS-FILE-SHAPES",
          "GATE-FIXTURE-SAFETY"
        ]
      },
      "needsReview": false
    },
    {
      "url": "https://en.doc.boardgamearena.com/Game_interface_logic:_Game.js",
      "digest": "sha256:b8c4e03dc51d86414a1498a3f97203c80320cf3d18539faf59e258377f78b021",
      "observedAt": "2026-10-02T12:04:13.675Z",
      "review": {
        "digest": "sha256:b8c4e03dc51d86414a1498a3f97203c80320cf3d18539faf59e258377f78b021",
        "implementationDigest": "sha256:a0acaa4956d2ab2bbb56a08116c56448e6565cc53c757ed9b0eb00c540897c5c",
        "evidenceDigest": "sha256:61af65f81b1f293934bc76d9ac16fba06b00f4d080d5bbe7e7f698f61f680ae3",
        "evidenceCommit": "a34f7cf2f699d8b25721cf91bfc901b58e788cc3",
        "ciRun": "https://github.com/Brandon-Born/bga-mcp/actions/runs/37015716008",
        "reviewer": "Codex",
        "reviewedAt": "2026-10-02T13:57:21.421Z",
        "fixturePaths": [
          "tests/fixtures/projects/comment-contract-controls",
          "tests/fixtures/projects/comment-contract-reproduction",
          "tests/fixtures/projects/hybrid",
          "tests/fixtures/projects/legacy",
          "tests/fixtures/projects/modern",
          "tests/fixtures/projects/modern-broken",
          "tests/fixtures/projects/modern-generated-regression",
          "tests/fixtures/projects/modern-source-scope-unreadable",
          "tests/fixtures/projects/modern-state-classes",
          "tests/fixtures/projects/modern-unreadable"
        ],
        "scenarios": [
          "E2E-AUDIT-DATABASE-ALIASES",
          "E2E-AUDIT-DATABASE-CLEAN",
          "E2E-AUDIT-DATABASE-HYBRID",
          "E2E-AUDIT-DATABASE-MODERN-CLEAN",
          "E2E-CONTRACT-COMMENT-METHOD-MISSING",
          "E2E-CONTRACT-EDITOR-HELPERS",
          "E2E-CONTRACT-EXECUTABLE-CONTROLS",
          "E2E-CONTRACT-INERT-EXAMPLES",
          "E2E-CONTRACT-UNKNOWN-GRAMMAR",
          "E2E-CONTRACT-UNKNOWN-PHP",
          "E2E-DOCS-ADVERTISED",
          "E2E-DOCS-TOPIC-LISTED",
          "E2E-FRAMEWORK-VERSION-LISTED",
          "E2E-INSPECT-JSONC-COMPONENTS",
          "E2E-INSPECT-PROJECT-HYBRID",
          "E2E-INSPECT-PROJECT-LEGACY",
          "E2E-INSPECT-PROJECT-MODERN",
          "E2E-LEGACY-CLIENT-ROOTS",
          "E2E-PRE-RELEASE-CLEAN",
          "E2E-PRE-RELEASE-HYBRID",
          "E2E-PRE-RELEASE-PARTIAL-SUPPORT",
          "E2E-PROJECT-SOURCE-MODULES",
          "E2E-PROJECT-SOURCE-SCOPE",
          "E2E-PROJECT-SOURCE-SELECTION",
          "E2E-RESOURCE-DIAGNOSTICS",
          "E2E-RESOURCE-LAYOUT-MATRIX",
          "E2E-RESOURCE-STATES",
          "E2E-RESOURCE-SUMMARY",
          "E2E-SETUP-READY",
          "E2E-STATE-DELEGATED-RETURNS",
          "E2E-STATE-UNCONFIRMED-INITIAL",
          "E2E-STUDIO-LOGS-DISABLED",
          "E2E-VALIDATE-ACTION-SCOPES",
          "E2E-VALIDATE-ACTIONS-CLEAN",
          "E2E-VALIDATE-ACTIONS-HYBRID",
          "E2E-VALIDATE-ACTIONS-MODERN-CLEAN",
          "E2E-VALIDATE-MODERN-DOCUMENTATION-CONFLICT",
          "E2E-VALIDATE-NOTIFICATIONS-CLEAN",
          "E2E-VALIDATE-NOTIFICATIONS-HYBRID",
          "E2E-VALIDATE-NOTIFICATIONS-MODERN-CLEAN",
          "E2E-VALIDATE-PROJECT-CLEAN",
          "E2E-VALIDATE-PROJECT-HYBRID",
          "E2E-VALIDATE-PROJECT-MODERN",
          "E2E-VALIDATE-STATES-CLEAN",
          "E2E-VALIDATE-STATES-HYBRID",
          "E2E-VALIDATE-STATES-MODERN-CLEAN",
          "E2E-VALIDATE-UNKNOWN-CROSS-FILE-SHAPES",
          "GATE-FIXTURE-SAFETY"
        ]
      },